{
  "id": "2d9f6a41-3b7e-4c92-8f05-1a6d4e8b3c70",
  "tag": "SWBD-101",
  "aliases": [
    { "value": "SWBD 101", "source": "cxalloy", "first_seen_at": "2026-08-04T09:12:00Z" },
    { "value": "SWBD-101", "source": "drawing_schedule", "first_seen_at": "2026-08-04T09:12:00Z" },
    { "value": "SB101", "source": "nameplate", "first_seen_at": "2026-09-02T14:38:00Z" }
  ],
  "equipment_class": "switchboard",
  "system": "normal power",
  "location": {
    "room": "Electrical Room 1-04",
    "grid_ref": "C/7",
    "model_coordinates": null,
    "location_type": "electrical_room"
  },
  "parent_asset": null,
  "cxalloy_id": "CX-EQ-88213",
  "submittal_ids": ["e5c81b34-9d27-4a60-b1f8-7c3e2a9d5064"],
  "reconciliation_status": "human_confirmed"
}
